{"$schema":"http://json-schema.org/draft-07/schema#","$id":"https://agentic-website-studio.local/schemas/m43-human-replaytest-decision.schema.json","type":"object","required":["schemaVersion","decisionId","projectId","evaluations","productRequirements","overallAction","automationApprovedExpansion"],"properties":{"schemaVersion":{"const":"1.0.0"},"decisionId":{"const":"decision_wayfinder_m42r_replay_01"},"projectId":{"const":"project_wayfinder"},"selectedConceptId":{"type":"string"},"recordedAt":{"type":"string"},"recordingNote":{"type":"string"},"replaytestGate":{"type":"object"},"evaluations":{"type":"object"},"productRequirements":{"type":"object"},"overallAction":{"const":"approve_for_expansion"},"humanStatement":{"type":"string"},"automationApprovedExpansion":{"const":false}}}
